{
  "evaluation_id": "RD-EVAL-DEMO-AUTHORITY-002",
  "result_packet_ref": "QR-DEMO-002",
  "risk_inputs": {
    "authority_change": true,
    "production_path_impact": true,
    "ledger_registry_change": false,
    "cross_node_involvement": false,
    "partial_completion": false,
    "incomplete_requirements": 0,
    "rc_failure_count": 0,
    "rc_total_count": 11,
    "e4_failure_count": 0,
    "e4_total_count": 10,
    "lightweight_lane": false
  },
  "composite_risk_score": 17,
  "assigned_depth": "heavy",
  "escalation_chain": ["ER-1", "ER-3", "ER-10"],
  "evaluated_at": "2026-07-08T07:31:00Z",
  "authority_disclaimer": "This risk-based review depth evaluation is advisory-only. It does not auto-accept evidence, auto-reject findings, execute work, approve intake, verify evidence, close workbench items, seal anything, mutate the evidence chain, or replace Owner decision authority. Owner remains the final decision point. Custody is qa-pilot-local. Librarian impact is none.",
  "custody": "qa-pilot-local",
  "advisory_only": true,
  "librarian_impact": "none"
}
